<?xml version="1.0" encoding="UTF-8"?>
<column xmlns:xsi="http://www.w3.org/2001/XMLSchema-instance" xsi:noNamespaceSchemaLocation="dashboard.xsd">

    <row>
        <range range="60" label="1m" />
        <range range="600" label="10m" />
        <range range="1800" label="30m" />
        <range range="3600" label="1h" />
        <range range="86400" label="1d" />
        <range range="604800" label="1w" />
        <range range="2592000" label="1M" />
        <range range="7776000" label="3M" />
    </row>

    <row widget_height="1" widget_color="DeepOrange">
        <label text="🔋 Battery" width="6" />
        <freshness series="f32_victron_battery_monitor_state_of_charge_pct" width="3" />
    </row>
    <row widget_height="4" widget_color="DeepOrange">
        <gauge label="SoC" width="3" series="f32_victron_battery_monitor_state_of_charge_pct" min="0" max="100" />
        <line label="Current A" width="4" series="f32_victron_battery_monitor_battery_current_a" />
        <line label="SoC %" width="5" series="f32_victron_battery_monitor_state_of_charge_pct" />
    </row>
    
    <row widget_height="1" widget_color="Blue">
        <label text="🚰 Water" width="6" />
        <freshness series="f32_water_drinking_bottom_level_pct" width="3" />
        <freshness series="f32_water_total_dissolved_solids_ppm" width="3" />
    </row>
    <row widget_height="4" widget_color="Blue">
        <value label="Level %" width="3" series="f32_water_drinking_bottom_level_pct" />
        <gauge label="Level %" width="3" series="f32_water_drinking_bottom_level_pct" min="0" max="100" />
        <line label="Level %" width="6" series="f32_water_drinking_bottom_level_pct" />
    </row>
    <row widget_height="4" widget_color="Blue">
        <value label="TDS PPM" width="3" series="f32_water_total_dissolved_solids_ppm" />
        <gauge label="TDS PPM" width="3" series="f32_water_total_dissolved_solids_ppm" min="0" max="200" />
        <line label="TDS PPM" width="6" series="f32_water_total_dissolved_solids_ppm" />
    </row>
    
    <row widget_height="1" widget_color="Amber">
        <label text="🌞 Solar - A + B" width="6" />
        <freshness series="f32_victron_mppt_a_b_yield_today_kwh" width="3" />
    </row>
    <row widget_height="4" widget_color="Amber">
        <value label="Today kWh" width="3" series="f32_victron_mppt_a_b_yield_today_kwh" />
        <line label="Current Power W" width="9" series="f32_victron_mppt_a_b_panel_power_w" />
    </row>
    
    <row widget_height="1" widget_color="Amber">
        <label text="🌞 Solar - C" width="6" />
        <freshness series="f32_victron_mppt_c_yield_today_kwh" width="3" />
    </row>
    <row widget_height="4" widget_color="Amber">
        <value label="Today kWh" width="3" series="f32_victron_mppt_c_yield_today_kwh" />
        <line label="Current Power W" width="9" series="f32_victron_mppt_c_panel_power_w" />
    </row>
    
    <row widget_height="1" widget_color="Amber">
        <label text="🌞 Solar - D" width="6" />
        <freshness series="f32_victron_mppt_d_yield_today_kwh" width="3" />
    </row>
    <row widget_height="4" widget_color="Amber">
        <value label="Today kWh" width="3" series="f32_victron_mppt_d_yield_today_kwh" />
        <line label="Current Power W" width="9" series="f32_victron_mppt_d_panel_power_w" />
    </row>
    
    <row widget_height="1" widget_color="Purple">
        <label text="∿ Inverter" width="6" />
        <freshness series="f32_victron_inverter_ac_voltage_v" width="3" />
    </row>
    <row widget_height="4" widget_color="Purple">
        <line label="Power Out W" width="12" series="f32_victron_inverter_ac_apparent_power_va" />
    </row>
    <row widget_height="4" widget_color="Purple">
        <line label="Voltage" width="12" series="f32_victron_inverter_ac_voltage_v" />
    </row>
    
    <row widget_height="1" widget_color="Green">
        <label text="⛅ Weather" width="6" />
        <freshness series="f32_weather_air_temp_c" width="3" />
    </row>
    <row widget_height="4" widget_color="Green">
        <value label="Air Temp C" width="3" series="f32_weather_air_temp_c" />
        <line label="Air Temp C" width="9" series="f32_weather_air_temp_c" />
    </row>
    <row widget_height="4" widget_color="Green">
        <value label="Wind m/s" width="3" series="f32_weather_wind_avg_mps" />
        <line label="Wind m/s" width="9" series="f32_weather_wind_avg_mps" />
    </row>
    <row widget_height="4" widget_color="Green">
        <line label="Rain mm/min" width="12" series="f32_weather_rain_amount_over_previous_minute_mm" />
    </row>
    <row widget_height="4" widget_color="Green">
        <line label="Solar Radiation w/m^2" width="12" series="f32_weather_solar_radiation_wpm" />
    </row>
    
    <row widget_height="1" widget_color="Brown">
        <label text="🏠 Cabin" width="6" />
        <freshness series="f32_cabin_temperature_c" width="3" />
    </row>
    <row widget_height="4" widget_color="Brown">
        <value label="Air Temp C" width="3" series="f32_cabin_temperature_c" />
        <line label="Air Temp C" width="9" series="f32_cabin_temperature_c" />
    </row>
    <row widget_height="4" widget_color="Brown">
        <value label="Humidity %" width="3" series="f32_cabin_relative_humidity_pct" />
        <line label="Humidity %" width="9" series="f32_cabin_relative_humidity_pct" />
    </row>

    <row widget_height="1" widget_color="Lime">
        <label text="🪴 Propagation Table" width="6" />
        <freshness series="f32_soil_moisture_vwc" width="3" />
    </row>
    <row widget_height="4" widget_color="Lime">
        <value label="Soil Moisture VWC%" width="3" series="f32_soil_moisture_vwc" />
        <gauge label="Soil Moisture VWC%" width="3" series="f32_soil_moisture_vwc" min="0" max="100" />
        <line label="Soil Moisture VWC%" width="6" series="f32_soil_moisture_vwc" />
    </row>
    <row widget_height="4" widget_color="Lime">
        <value label="Soil Temperature C" width="3" series="f32_soil_temperature_c" />
        <gauge label="Soil Temperature C" width="3" series="f32_soil_temperature_c" min="0" max="100" />
        <line label="Soil Temperature C" width="6" series="f32_soil_temperature_c" />
    </row>

    <row widget_height="1" widget_color="DarkGray">
        <label text="🤖🌞 Solar Server" width="6" />
        <freshness series="f32_computer_solar_load_avg_pct_5mins" width="3" />
    </row>
    <row widget_height="4" widget_color="DarkGray">
        <value width="3" label="Load %" series="f32_computer_solar_load_avg_pct_5mins" />
        <gauge width="3" label="Load" series="f32_computer_solar_load_avg_pct_5mins" min="0" max="100" />
        <line width="6" label="Load %" series="f32_computer_solar_load_avg_pct_5mins" />
    </row>
    <row widget_height="4" widget_color="DarkGray">
        <value width="3" label="Disk Free %" series="f32_computer_solar_disk_free_pct" />
        <gauge width="3" label="Disk Free" series="f32_computer_solar_disk_free_pct" min="0" max="100" />
        <line width="6" label="Disk Free %" series="f32_computer_solar_disk_free_pct" />
    </row>
    <row widget_height="4" widget_color="DarkGray">
        <value width="3" label="Memory Free %" series="f32_computer_solar_memory_free_pct" />
        <gauge width="3" label="Memory Free" series="f32_computer_solar_memory_free_pct" min="0" max="100" />
        <line width="6" label="Memory Free %" series="f32_computer_solar_memory_free_pct" />
    </row>
    <row widget_height="4" widget_color="DarkGray">
        <value width="3" label="# Processes" series="f32_computer_solar_proc_total" />
        <line width="9" label="# Processes" series="f32_computer_solar_proc_total" />
    </row>

    <row widget_height="1" widget_color="DarkGray">
        <label text="🤖🏠 Cabin Server" width="6" />
        <freshness series="f32_computer_cabin_load_avg_pct_5mins" width="3" />
    </row>
    <row widget_height="4" widget_color="DarkGray">
        <value width="3" label="Load %" series="f32_computer_cabin_load_avg_pct_5mins" />
        <gauge width="3" label="Load" series="f32_computer_cabin_load_avg_pct_5mins" min="0" max="100" />
        <line width="6" label="Load %" series="f32_computer_cabin_load_avg_pct_5mins" />
    </row>
    <row widget_height="4" widget_color="DarkGray">
        <value width="3" label="Disk Free %" series="f32_computer_cabin_disk_free_pct" />
        <gauge width="3" label="Disk Free" series="f32_computer_cabin_disk_free_pct" min="0" max="100" />
        <line width="6" label="Disk Free %" series="f32_computer_cabin_disk_free_pct" />
    </row>
    <row widget_height="4" widget_color="DarkGray">
        <value width="3" label="Memory Free %" series="f32_computer_cabin_memory_free_pct" />
        <gauge width="3" label="Memory Free" series="f32_computer_cabin_memory_free_pct" min="0" max="100" />
        <line width="6" label="Memory Free %" series="f32_computer_cabin_memory_free_pct" />
    </row>
    <row widget_height="4" widget_color="DarkGray">
        <value width="3" label="# Processes" series="f32_computer_cabin_proc_total" />
        <line width="9" label="# Processes" series="f32_computer_cabin_proc_total" />
    </row>
    
</column>